{
  "schema": "lylat-validated-detections/1",
  "range_build_ref": "a1b2c3d4e5f6",
  "generated_at": "2026-10-18T14:30:00Z",
  "rows": [
    {
      "mission_id": "SYNTH-MISSION-A",
      "technique_ref": { "domain": "enterprise", "id": "T1558.003", "attack_version": "19.2" },
      "detection_ref": "wazuh:990001",
      "coverage_state": "validated",
      "outcome": "alerted",
      "negative_control": "detection-only",
      "validated_at": "2026-10-18",
      "evidence_ref": "SYNTH-MISSION-A-step1"
    },
    {
      "mission_id": "SYNTH-MISSION-A",
      "technique_ref": { "domain": "enterprise", "id": "T1558.003", "attack_version": "19.2" },
      "detection_ref": "wazuh:990002",
      "coverage_state": "validated",
      "outcome": "blocked",
      "negative_control": "blocked-on-hardened",
      "validated_at": "2026-10-18",
      "evidence_ref": "SYNTH-MISSION-A-step2"
    },
    {
      "mission_id": "SYNTH-MISSION-A",
      "technique_ref": { "domain": "enterprise", "id": "T1087.002", "attack_version": "19.2" },
      "detection_ref": "wazuh:990003",
      "coverage_state": "validated",
      "outcome": "alerted",
      "negative_control": "detection-only",
      "validated_at": "2026-10-18",
      "evidence_ref": "SYNTH-MISSION-A-step3"
    },
    {
      "mission_id": "SYNTH-MISSION-A",
      "technique_ref": { "domain": "enterprise", "id": "T1078.002", "attack_version": "19.2" },
      "detection_ref": "wazuh:990004",
      "coverage_state": "validated",
      "outcome": "alerted",
      "negative_control": "detection-only",
      "validated_at": "2026-10-19",
      "evidence_ref": "SYNTH-MISSION-A-step4"
    },
    {
      "mission_id": "SYNTH-MISSION-A",
      "technique_ref": { "domain": "enterprise", "id": "T1059.001", "attack_version": "19.2" },
      "detection_ref": "wazuh:990005",
      "coverage_state": "validated",
      "outcome": "blocked",
      "negative_control": "blocked-on-hardened",
      "validated_at": "2026-10-19",
      "evidence_ref": "SYNTH-MISSION-A-step5"
    },
    {
      "mission_id": "SYNTH-MISSION-A",
      "technique_ref": { "domain": "enterprise", "id": "T1003.001", "attack_version": "19.2" },
      "detection_ref": "wazuh:990006",
      "coverage_state": "validated",
      "outcome": "alerted",
      "negative_control": "detection-only",
      "validated_at": "2026-10-19",
      "evidence_ref": "SYNTH-MISSION-A-step6"
    },
    {
      "mission_id": "SYNTH-MISSION-A",
      "technique_ref": { "domain": "enterprise", "id": "T1003.001", "attack_version": "19.2" },
      "detection_ref": "wazuh:990007",
      "coverage_state": "telemetry-observed",
      "outcome": "logged",
      "negative_control": "detection-only",
      "validated_at": "2026-10-20",
      "evidence_ref": "SYNTH-MISSION-A-step7"
    },
    {
      "mission_id": "SYNTH-MISSION-A",
      "technique_ref": { "domain": "enterprise", "id": "T1021.002", "attack_version": "19.2" },
      "detection_ref": "wazuh:990008",
      "coverage_state": "validated",
      "outcome": "blocked",
      "negative_control": "blocked-on-hardened",
      "validated_at": "2026-10-20",
      "evidence_ref": "SYNTH-MISSION-A-step8"
    }
  ]
}
